{
 "formatVersion": "1.0",
 "id": "ew-calendar-week",
 "stage": "I-III",
 "title": {
  "pl": "Dni tygodnia"
 },
 "objectives": [
  "I-III.5.a"
 ],
 "tags": [
  "no-calculator"
 ],
 "levels": [
  {
   "level": 1,
   "label": {
    "pl": "Za kilka dni"
   }
  },
  {
   "level": 2,
   "label": {
    "pl": "Kilka dni temu"
   }
  }
 ],
 "taskSources": [
  {
   "type": "generator",
   "ref": "generators/ew-calendar-week.json",
   "levels": [
    1,
    2
   ]
  }
 ],
 "area": "I-III.5",
 "tutor": {
  "intro": {
   "pl": "Tydzień ma 7 dni: poniedziałek, wtorek, środa, czwartek, piątek, sobota, niedziela. Po niedzieli znów jest poniedziałek. Żeby znaleźć dzień za 3 dni, przesuń się o 3 dni do przodu."
  }
 }
}
