{
 "formatVersion": "1.0",
 "id": "ew-roman-read",
 "stage": "I-III",
 "title": {
  "pl": "Przeczytaj liczbę rzymską"
 },
 "objectives": [
  "I-III.1.n"
 ],
 "tags": [
  "no-calculator"
 ],
 "levels": [
  {
   "level": 1,
   "label": {
    "pl": "Na tarczy zegara"
   }
  }
 ],
 "taskSources": [
  {
   "type": "generator",
   "ref": "generators/ew-roman-read.json",
   "levels": [
    1
   ]
  }
 ],
 "area": "I-III.1",
 "tutor": {
  "intro": {
   "pl": "Cyfry rzymskie: I = 1, V = 5, X = 10, L = 50, C = 100. Gdy mniejsza stoi przed większą, odejmujemy (IV = 4), w przeciwnym razie dodajemy (VI = 6)."
  }
 }
}
